id,context,question,A,B,C,D,answer
40,财联社5月31日电，有投资者问，近期人民币兑美元汇率贬值是否利好公司？森麒麟在互动平台表示，汇率变化属长期存在的客观因素，人民币兑美元汇率贬值总体上有利于出口，同时，公司建立了较完善的汇率波动应对机制，在人民币兑美元汇率升值时将最大程度避免不利影响。,人民币兑美元汇率贬值是否利好公司？,是，汇率贬值有利于公司出口,是，公司已建立完善的汇率波动应对机制,否，汇率贬值会对公司产生不利影响,否，公司无法应对人民币兑美元汇率的变化,B
41,【*ST泛海：股票交易异常波动正在开展的预重整工作按监管规则披露】财联社10月15日电，*ST泛海披露股票交易异常波动公告，公司董事会确认，公司正在开展的预重整工作按监管规则披露，公司目前没有任何根据《深圳证券交易所股票上市规则》等有关规定应予以披露而未披露的其他事项或与该事项有关的筹划、商谈、意向、协议等。,根据资讯内容，*ST泛海公司正在进行的预重整工作是否符合监管规则？,是，因为公司已经披露了股票交易异常波动公告。,否，因为公司没有披露与该事项有关的筹划、商谈、意向、协议等。,是，因为公司董事会确认了预重整工作符合监管规则。,否，因为公司没有根据深圳证券交易所股票上市规则披露其他未披露的事项,A
42,【氟化工板块异动拉升中欣氟材直线涨停】财联社10月12日电，氟化工板块盘中异动拉升，中欣氟材直线涨停，联创股份大涨5%，永和股份、多氟多、金石资源、巨化股份等快速跟涨。消息面上，氟化工龙头梅兰集团第三代制冷剂主力品种R32报价，从1.45万元/吨上调至1.7万元/吨，涨幅超17%；R22上调500元/吨至2万元/吨；R134a因货源紧张暂不接单。,氟化工行业中欣氟材股价异动的原因是什么？,氟化工龙头梅兰集团上调制冷剂R32的价格,联创股份的股价大涨,永和股份、多氟多、金石资源、巨化股份等企业跟涨,氟化工行业供应紧张,A
43,【热门中概股多数下跌京东跌超2%】财联社10月14日电，热门中概股多数下跌，京东、哔哩哔哩、百度、腾讯音乐、微博跌超2%，网易、唯品会跌超1%，小鹏汽车、阿里巴巴、理想汽车小幅下跌。富途控股、爱奇艺涨超1%，蔚来小幅上涨。,以下哪家公司的股价上涨了？,京东,哔哩哔哩,腾讯音乐,富途控股,D
44,【央行邹澜：近期房地产市场出现积极变化高频数据显示重点城市交易活跃度有所上升】财联社10月13日电，近期房地产市场出现积极变化，高频数据显示重点城市交易活跃度有所上升。从信贷数据看，9月主要银行的房地产开发贷款和个人住房贷款合计较上月多增1000多亿元，保持明显回升态势。目前存量住房贷款利率调降已完成5000万笔，涉及22万亿元贷款，利率平均降幅0.73个百分点。,近期房地产市场出现的积极变化主要体现在哪方面？,交易活跃度的上升,信贷数据的下降,存量住房贷款利率的上升,个人住房贷款数量的减少,A
45,【哈尔滨铁路局公布K5133次旅客列车车辆脱轨原因】财联社10月15日电，哈尔滨铁路通报，10月15日3时50分许，黑龙江黑河地方铁路公司一施工的工程车辆在黑河市境内地方铁路孙吴北站至潮水站间倾覆侵入铁路线路，导致运行至此的K5133次旅客列车机车及机车后第1至4位车辆脱轨。哈尔滨铁路局集团公司积极配合地方铁路部门开展救援起覆，车上旅客和工作人员全部平安，已安全转运。,在哈尔滨铁路局公布的K5133次旅客列车脱轨事故中，脱轨原因是什么？,地震导致,机车故障,铁轨老化,工程车辆倾覆,D
46,"""财联社2月8日电，有投资者问，据说双洛平医保谈判失败，公司作为上市公司为什么不公告一下双洛平医保谈判失败的原因？请尽快回复？ 微芯生物（688321.SH）（688321.SH）在互动平台表示，西格列他钠已经成功进入医保，详细信息请参阅公司于2023年1月20日披露的《自愿披露关于公司产品西格列他钠新纳入《国家医保目录》的公告》。""",微芯生物是否公告了双洛平医保谈判失败的原因？,公告了,未公告,公告了西格列他钠的医保成功进入,公告了关于公司产品新进入《国家医保目录》的公告,B
47,财联社7月20日电，有投资者问，公司变压器互感器车间配置有专业的生产设备，主要用于生产自有产品使用的变压器、互感器。依据目前公司的产能利用情况，有没有对外进行销售？西力科技在互动平台表示，公司目前变压器、互感器的产能配置主要用于自有产品的配套，少量用于对外销售。,西力科技的变压器、互感器产能配置情况如何？,公司变压器、互感器的产能配置主要用于自有产品的配套,公司变压器、互感器的产能配置主要用于对外销售,公司变压器、互感器的产能配置既用于自有产品的配套，又用于对外销售,公司变压器、互感器的产能配置没有使用,A
48,【国联股份：前三季度净利润同比预增47.18%至47.91%】财联社10月13日电，国联股份公告，预计前三季度实现净利润10.05亿元至10.1亿元，同比增长47.18%至47.91%。业绩增长的主要原因是公司网上商品交易收入增长。,国联股份前三季度净利润增长的主要原因是什么？,公司网上商品交易收入增长,股票价格上涨,公司扩张了生产规模,公司进行了股权转让,A
49,财联社8月18日电，有投资者问，公司口口声声说未来智慧供热前景一片光明，可市场不买账，这是为什么？瑞纳智能在互动平台表示，当前国内经济形式复杂，但公司对国内智慧供热的总体形式看好。公司将在持续巩固现有市场的基础上，积极开拓新市场，加大技术研发投入，不断提升技术水平和产品性能，增强公司核心竞争力，争取以更好的业绩回报广大投资者。,瑞纳智能公司对于未来智慧供热前景的态度是什么？,公司对国内智慧供热的形式并不看好,公司打算放弃智慧供热市场，转向其他领域,公司将加大技术研发投入，提升技术水平和产品性能,公司认为智慧供热市场前景非常不明朗,C
50,【南华仪器：信披不准确董事长等收到广东证监局警示函】财联社10月12日电，南华仪器公告，公司近日收到广东证监局关于对公司杨耀光、梁伟明、周柳珠、伍颂颖采取出具警示函措施的决定。经查，公司2022年业绩预告与2022年年度报告中披露的相关数据相比差异较大，信息披露不准确。根据相关规定，广东证监局决定对公司董事长杨耀光、总经理梁伟明、财务总监周柳珠、董事会秘书伍颂颖采取出具警示函的行政监管措施。,南华仪器收到广东证监局警示函的原因是什么？,公司财务数据与年报相差较大,公司董事长涉嫌违法行为,公司业绩预告未达到市场预期,公司信息披露不充分,A
51,【 都市丽人（02298.HK）午后再次拉升股价涨超17%】财联社 2月24日 电，都市丽人午后拉升，截至发稿，股价涨17%，报0.445港元。月内股价累计涨幅1.1倍，机构称公司受惠线下消费回暖。,都市丽人（02298.HK）股价上涨原因是什么？,公司新闻发布了利好消息,公司获得了一笔巨额投资,公司受益于线下消费回暖,公司宣布并购了一家竞争对手,C
52,"2023年8月3日，财联社电，浩通科技高管余志灏提出减持计划，因为个人资金需求,持股人原持股份1590000股，减持上市公司股份不超过97500股，计划减持股份比例不超过公司股份总数的0.09%,减持日期至2023年12月29日",浩通科技高管余志灏的减持计划是基于以下哪个原因？,个人资金需求,公司股份总数超过预期,股价下跌导致减持,公司业绩下滑导致减持,A
53,财联社7月18日电，有投资者问，董秘，电声领域，公司以人工智能及无线音频为突破口，持续提升语音交互及物联网等产品开发能力。公司与小米、华为等知名企业合作较为顺利，均是属于公司的重要客户，在汽车领域上，公司的电声产品有与他们合作吗？或者和其他汽车公司合作？奋达科技在互动平台表示，公司暂未与小米、华为等企业在汽车领域有合作。,奋达科技在汽车领域的合作情况如何？,公司与小米、华为等企业在汽车领域有合作,公司与其他汽车公司有合作,公司暂未与小米、华为等企业在汽车领域有合作,公司在汽车领域没有任何合作,C
54,【 恒勃股份：公司目前业务暂未应用人工智能领域】财联社 6月19日电，恒勃股份在互动平台表示，公司在新能源车领域的产品应用正逐步拓宽，公司已量产应用于PHEV车型的进气系统零部件，并获得客户纯电动 汽车的冷却系统零部件订单。公司目前业务暂未应用人工智能领域。,关于恒勃股份的业务应用情况，以下哪个选项是正确的？,公司的业务已经应用人工智能领域,公司的产品已应用于传统燃油车领域,公司已经获得客户纯电动汽车的进气系统零部件订单,公司正在拓宽新能源车领域的产品应用,C
55,【首航高科：受让慧添新能源40%股权】财联社10月13日电，首航高科公告，为进一步开发光热发电项目，近日，公司与海南慧天企业管理有限公司签署了《股权转让协议》。首航高科拟以0元受让慧天企管所持有的瓜州慧添新能源开发有限公司40%的股权认缴份额（对应慧添新能源800.00万元注册资本）。,首航高科与海南慧天企业管理有限公司签署的《股权转让协议》是为了？,扩大光热发电项目规模,减少慧添新能源的注册资本,增加首航高科的股权比例,购买海南慧天企业管理有限公司的股权,A
56,"""【 卫龙（09985.HK）尾盘涨约7%机构看好公司23年享受提价红利】财联社 2月8日电，，次新股卫龙尾盘涨约7%。 海通国际（00665.HK）最新的研究认为，卫龙是辣条行业领导者，疫后有场景修复的弹性。高端化持续进行，2023年有望享受提价红利。截至发稿，卫龙涨7.10%，报10.86港元。""",卫龙公司的股价涨幅以及机构看好的原因是什么？,股价涨幅约为5%，主要是因为产品疫后需求增加。,股价涨幅约为7%，主要是因为卫龙是辣条行业领导者。,股价涨幅约为9%，主要是因为公司展望2023年有望享受提价红利。,股价涨幅约为7%，主要是因为卫龙已推行高端化战略。,B
57,【国际原子能机构总干事视察日本福岛第一核电站并设立办事处】财联社 7月5日电，据日本广播协会5日报道，当地时间5日，国际原子能机构（IAEA）总干事格罗西视察日本福岛第一核电站，并在该核电站内开设了IAEA职员常驻的办事处。,国际原子能机构总干事格罗西视察了以下哪个核电站，并设立了办事处？,福岛第一核电站,福岛第二核电站,南海核电站,广西核电站,A
58,【广州地铁遭受恐怖袭击？警方：系谣言正在追查造谣者】财联社10月12日电，一则“广州地铁遭受恐怖袭击”的信息在网络社交平台传播。广州警方立即开展核查。经查，广州辖区未收到任何相关警情，广州地铁运行正常，全市社会治安秩序正常，该信息系谣言。目前，警方正在追查造谣者。,关于广州地铁恐怖袭击的信息，下列哪个选项是正确的？,广州警方已确认广州地铁遭受恐怖袭击,广州地铁已经停运，暂时关闭,广州辖区已接到多起与地铁恐怖袭击有关的警情,广州地铁正常运行，社会治安秩序正常,D
59,【郭明𫓹：中国手机市场底部将过将重拾成长】财联社10月13日电，郭明𫓹13日在X（原推特）上发文表示，中国手机市场底部将过，预期将重拾成长。十一长假手机销售显著成长约15%YoY，4Q23手机出货QoQ与YoY亦预期均重拾成长。Android品牌已无杀价竞争，且成本亦较过去数年下降，故有利品牌商利润。,根据资讯内容，中国手机市场底部将过将重拾成长。以下哪个选项是正确的理由？,十一长假手机销售下降了约15%YoY,Android品牌的杀价竞争还在继续,过去数年下降的成本对品牌商利润没有影响,郭明𫓹在发文中提到中国手机市场的底部将过,D
60,【国产光刻机工厂落地雄安？中国电子院澄清：这是北京高能同步辐射光源】财联社9月18日电，一则消息在各大视频平台广为传播，称清华大学EUV项目把ASML的光刻机巨大化，实现了光刻机国产化，并表示这个项目已经在雄安新区落地。对此，中国电子工程设计院有限公司（中国电子院）9月18日发声，称该项目并非网传的国产光刻机工厂，而是北京高能同步辐射光源项目（HEPS）。,关于国产光刻机工厂在雄安新区落地的说法，下列哪个选项是正确的？,国产光刻机工厂项目是在清华大学进行的,国产光刻机工厂项目已经在雄安新区实施,国产光刻机工厂项目是北京高能同步辐射光源项目,国产光刻机工厂项目是由中国电子院负责的,C
61,【今年1至9月我国新建主干油气管道突破2500公里】财联社10月14日电，今年以来，我国大力推动油气管网基础设施建设，一批国家重点项目加速建设、顺利投产，1到9月份我国新建主干油气管道里程突破2500公里，创历史新高。,今年1至9月我国新建主干油气管道突破2500公里，这一数据在以下哪个方面可以得到佐证？,国内石油供需关系,国际油价走势,国内能源消费量,国内油气管网建设速度,D
62,【粮农组织称过去30年全球农业因灾害损失约3.8万亿美元】财联社10月14日电，联合国粮食及农业组织（粮农组织）13日发布一份有关灾害对全球农业生产和粮食安全影响的评估报告，其中指出灾害事件在过去30年中导致作物和牲畜产量损失约3.8万亿美元。报告指出，全球灾害事件发生频率从上世纪70年代的每年约100起增加到过去20年的每年约400起，灾害事件的强度和复杂性也在上升。,根据联合国粮农组织的评估报告，以下哪个陈述是正确的？,过去30年全球的灾害事件导致了农业损失约1万亿美元。,过去30年全球的灾害事件导致了农业损失约5万亿美元。,过去30年全球的灾害事件导致了农业损失约2万亿美元。,过去30年全球的灾害事件导致了农业损失约4万亿美元。,D
63,【半导体巨头铠侠和西数或于本月达成合并协议】财联社10月13日电，据日本共同社，正在为经营合并而展开磋商的半导体巨头铠侠控股（东京）与合作方美国西部数据公司（WD）预计最快于本月内达成协议。若实现合并，半导体存储器业务将达到全球最大规模。新设立的控股公司在以设备投资为目的容易筹集资金的预期下，打算在美国纳斯达克上市。鉴于半导体存储器市场状况恶化，将通过合理经营谋求生存。,半导体巨头铠侠和西数的合并协议预计最快在本月达成，以下选项中哪个是正确的？,合并后的新控股公司将在美国纳斯达克上市,合并后的新控股公司将在日本东京上市,合并后的新控股公司将在中国上海上市,合并后的新控股公司将在欧洲伦敦上市,A
64,"【华绿生物：拟与思威博设立合资公司】财联社10月13日电，华绿生物公告，公司与江苏思威博生物科技有限公司(简称“思威博”)签署《合作协议》，各方同意共同出资设立合资公司。合资公司注册资本1,000.00万元，其中，公司出资510.00万元，持有合资公司51.00%股权；思威博出资490.00万元，持有合资公司49.00%股权。",华绿生物和思威博生物科技有限公司签署了什么协议?,合作协议,投资协议,竞争协议,合并协议,A
65,【济民医疗：与日本小田医院签署战略合作协议】财联社10月15日电，济民医疗公告，公司与日本小田医院共同签署《战略合作协议》，双方拟在深化公司控股子公司博鳌国际医院有限公司与日本小田医院的合作关系、启动细胞治疗技术领域研究及临床应用的合作、合作开展细胞培养基国产化项目展开合作。,济民医疗与哪家日本医院签署了战略合作协议?,小田医院,博鳌国际医院,另一家未提及的日本医院,合作协议中没有提到具体合作的医院,A
66,"""财联社2月6日电，有投资者问，公司占隆深机构人12.63%，请问隆深机器人的业绩情况如何？该公司主要业务能介绍 一下吗？ 友阿股份（002277.SZ）在互动平台表示，1、公司于2017年参股隆深机器人，目前仅占其注册资本的12.63%，公司不直接参与其日常经营管理。2、隆深机器人主要业务为工业机器人本体。""",隆深机器人的主要业务是什么？,人力资源服务,工业机器人本体,金融投资,互联网技术,B
67,【中国医药：子公司诺氟沙星胶囊视同通过仿制药一致性评价】财联社10月12日电，中国医药公告，近日，公司下属全资子公司天方有限收到国家药监局核准签发的一份诺氟沙星胶囊《药品补充申请批准通知书》，该药品视同通过仿制药质量和疗效一致性评价。诺氟沙星胶囊属于氟喹诺酮类抗感染药，适用于敏感菌所致的尿路感染、淋病、前列腺炎、肠道感染和伤寒及其他沙门菌感染。,中国医药公告的子公司诺氟沙星胶囊视同通过了什么评价?,国家药监局核准签发的批准通知书,全球医药批准机构的认可证书,国际药品研发机构的授予荣誉称号,互联网药品监管机构的认证证书,A
68,【均普智能：相关产线生产的终端产品会上车华为HI模式或智选模式相关车型】财联社10月13日电，均普智能在互动平台表示，公司为客户提供车载控制系统装配智能产线，据了解相关产线生产的终端产品会上车华为HI模式或智选模式相关车型。,均普智能提供的车载控制系统装配智能产线使用的终端产品会上车哪种模式的相关车型？,华为AR模式相关车型,华为智选模式相关车型,华为AI模式相关车型,华为低能耗模式相关车型,B
69,"""【 国药现代（600420.SH）：子公司注射用头孢美唑钠通过仿制药一致性评价】财联社 2月8日电，国药现代公告，近日，公司控股子公司国药致君收到国家药监局核准签发的《药品补充申请批准通知书》，批准注射用头孢美唑钠（0.5g）通过仿制药质量和疗效一致性评价。""",国药现代子公司的注射用头孢美唑钠通过了什么评价?,化妆品一致性评价,药品一致性评价,食品安全评价,环境保护评价,B
70,【境外黄脊竹蝗迁飞入境云南3000亩林地受损害】财联社8月20日电，近日，记者从云南省林草局获悉，今年黄脊竹蝗于6月18日跨越边境线从老挝本怒县、丰沙里县直接进入云南江城牛洛河自然保护区，随后在7月24日迁飞规模达到最大。部分种群可能向西双版纳州勐腊县、红河州绿春县迁飞。截至8月17日，云南3004.5亩林地受到黄脊竹蝗不同程度损害，危害程度以轻度为主，尚未成灾。,黄脊竹蝗对云南林地的损害情况是？,林地受损害程度轻微,林地受损害程度严重,黄脊竹蝗没有对林地造成损害,黄脊竹蝗已经灭绝,A
71,财联社6月16日电，有投资者问，请问贵公司有没有水电与虚拟电厂的业务？赣能股份在互动平台表示，公司主营火力、水力及新能源发电，所属水电厂两家，总装机规模10万千瓦，分别为居龙潭水电厂和抱子石水电厂，装机容量分别为23万千瓦和22万千瓦，分别位于江西省赣州市和九江市修水县。另外，公司受托管理江投集团下辖江西东津发电有限责任公司，装机容量为23万千瓦，公司暂无虚拟电厂业务。,赣能股份的主营业务包括哪些？,火力、水力及新能源发电,水电和虚拟电厂业务,水力、新能源发电及虚拟电厂业务,火力和虚拟电厂业务,
72,【证券时报评论：科技白马股频现闪崩的市场寓意】财联社 10月14日讯，证券时报头版评论称，在科技浪潮席卷A股市场，叠加券商资管理财产品、公募基金大量发行的背景下，科技白马股出现廉价筹码派发的可能性并不大，闪崩更大的意义在于引导资金回归基本面、淡化投机，同时也意味着机构资金在科技白马股的选择上将进入以盈利增长驱动的第二阶段。,科技白马股闪崩市场的寓意是什么？,科技白马股将出现廉价筹码派发,闪崩意味着资金回归基本面、淡化投机,科技白马股的选择将进入盈利增长驱动的第一阶段,机构资金将选择其他行业投资,
73,【国家林草局：我国森林资源逐步盘活全国林权抵押贷款余额1300多亿元】财联社10月12日电，国新办12日就《深化集体林权制度改革方案》有关情况举行发布会。国家林业和草原局副局长唐芳林介绍，我国森林资源逐步盘活。围绕回答“钱从哪里来”，创新林权融资机制，推动集体林资源变资产、资产变资金。建立了林权抵押贷款制度，全国林权抵押贷款余额1300多亿元，成为支持林业生态建设和产业发展的重要资金来源。,国家林草局建立了哪项机制？,林权融资机制,生态建设机制,资产变资金机制,集体林权制度改革机制,
74,【耀皮玻璃：子公司天津耀皮浮法玻璃二线停产冷修】财联社10月12日电，耀皮玻璃公告，公司控股子公司天津耀皮浮法玻璃生产线TSYP2（简称“TSYP2”）于2013年4月28日点火投产，目前运行已超预期寿命，窑炉等主要设备已老化，能耗较高，蓄热室格子体也已开始出现堵塞和坍塌的现象，继续生产将影响产品成品率，因此，TSYP2生产线将于10月14日停产冷修，进行技改升级。,天津耀皮浮法玻璃生产线停产的原因是什么？,设备老化，能耗较高,产品成品率下降,窑炉爆炸,技改升级,
75,【吉尔吉斯斯坦批准与俄罗斯建立联合区域防空系统的协议】财联社10月12日电，吉尔吉斯斯坦总统办公厅10月12日发布消息称，吉尔吉斯斯坦批准了与俄罗斯关于建立联合区域防空系统的协议。吉尔吉斯斯坦总统办公厅发布的消息表示，协议的批准确认了吉尔吉斯斯坦加强与俄罗斯战略关系的承诺，并促进了两国在国防与安全领域进一步合作的发展。这将确保两国领空得到更可靠的保护，加强对国家利益的安全和保护。,吉尔吉斯斯坦与俄罗斯建立联合区域防空系统的协议是为了什么目的？,加强两国的经济合作,加强两国的军事合作,加强两国的文化交流,加强两国的环境保护,
76,【尖峰集团：子公司甲磺酸仑伐替尼胶囊获药品注册证书】财联社10月12日电，尖峰集团公告，近日，控股子公司浙江尖峰药业收到国家药监局核准签发的甲磺酸仑伐替尼胶囊《药品注册证书》，标志着尖峰药业具有进行该药品生产，销售的资格。甲磺酸仑伐替尼是一款由日本卫材研发的多靶点的靶向抗癌药，同时对血管内皮细胞生长因子、成纤维细胞生成因子、血小板源生长因子受体及RET与KIT的口服小分子酪氨酸激酶抑制剂。,甲磺酸仑伐替尼胶囊获得药品注册证书的意义是什么？,甲磺酸仑伐替尼胶囊已经被证实对多种癌症有效。,甲磺酸仑伐替尼胶囊有望成为治疗癌症的首选药物。,尖峰集团已经具备了甲磺酸仑伐替尼胶囊的生产和销售资格。,甲磺酸仑伐替尼胶囊是一款日本研发的抗癌药物。,
77,【太钢不锈：拟设立太钢不锈临汾子公司】财联社10月13日电，太钢不锈公告，为了做大做强公司中厚板产线产品，充分拓展公司在临汾的发展空间，公司在原山西太钢不锈钢股份有限公司临汾分公司的基础上独家出资设立子公司山西太钢临汾中厚板有限公司，注册资本7000万元，注销山西太钢不锈钢股份有限公司临汾分公司。,太钢不锈公司拟设立太钢不锈临汾子公司的目的是什么？,扩大公司在临汾的发展空间,提高中厚板产线产品的产量,注销山西太钢不锈钢股份有限公司临汾分公司,减少公司在临汾的投资,
