id,context,question,A,B,C,D,answer
78,【 新化股份：拟合资兴建一期1万吨/年的废旧锂回收生产线】财联社 6月30日电，新化股份公告，与江苏耀宁新能源有限公司、上海添乾咨询管理合伙企业（有限合伙）在建德市共同出资成立合资公司，合资公司将投资兴建一期1万吨/年的废旧锂回收生产线。,新化股份拟与哪两家公司合作建设废旧锂回收生产线?,江苏耀宁新能源有限公司和上海添乾咨询管理合伙企业,江苏耀宁新能源有限公司和建德市政府,上海添乾咨询管理合伙企业和建德市政府,江苏耀宁新能源有限公司和江苏新化新能源科技有限公司,
79,【锂矿股再度反弹融捷股份涨超6%】财联社10月12日电，锂矿股早盘再度反弹，融捷股份涨超6%，中矿资源、永兴材料、江特电机、天齐锂业、赣锋锂业等跟涨。五矿期货指出，国内外新能源汽车增速较去年放缓，但仍保持同比约40%的高速增长。2023年预计全球锂离子电池产量超过1300GWh，对应碳酸锂需求约为86万吨，较去年增长30%-40%。,锂矿股反弹，以下哪只股票跟涨幅度最高?,融捷股份,中矿资源,永兴材料,江特电机,
80,【 华西股份：实际控制人拟发生变更】财联社 7月20日电，华西股份公告，实际控制人华西村委会拟将其持有的江苏华西集团有限公司80%股权转让给江阴联华优化调整产业投资合伙企业（有限合伙）；本次权益变动后公司控股股东仍为华西集团，公司实际控制人将由华西村委会变更为江阴市人民政府国有资产监督管理办公室。,华西股份的实际控制人将发生变更，将股权转让给哪家企业？,华西村委会,江阴联华优化调整产业投资合伙企业,华西集团,江阴市人民政府国有资产监督管理办公室,
81,【央行货币政策司邹澜：降低存量房贷利率工作已基本接近尾声】财联社10月13日电，今日在央行举行的三季度金融统计数据发布会上，央行货币政策司司长邹澜表示，近期一系列利率政策取得显著成效，市场反应良好，后续效果还将持续显现。降低存量房贷利率工作已基本接近尾声。老百姓普遍反映存量房贷利率降低，明显减少了利息负担，降低了提前还贷动力，增加投资和消费信心和能力，预计此项措施效应还将持续。,央行货币政策司司长邹澜表示，降低存量房贷利率工作已基本接近尾声，这一措施的效果如何？,降低存量房贷利率取得了显著成效,降低存量房贷利率对市场反应不佳,降低存量房贷利率对老百姓没有明显减少利息负担,降低存量房贷利率没有增加投资和消费信心和能力,
82,【国内期货主力合约涨跌不一低硫燃料油（LU）涨超2%】财联社10月12日电，国内期货主力合约涨跌不一，低硫燃料油（LU）涨超2%、丁二烯橡胶涨近2%，菜油、苯乙烯、燃油涨超1%。下跌方面，焦炭跌超1%。,以下哪个期货主力合约涨幅最高？,低硫燃料油（LU）,丁二烯橡胶,菜油,焦炭,
83,【国家林草局：集体林地产出每亩约300元比林改前增长3倍多】财联社10月12日电，国务院新闻办公室12日举行新闻发布会，介绍《深化集体林权制度改革方案》有关情况。国家林业和草原局副局长唐芳林介绍，围绕回答“单家独户怎么办”，推动林权流转和林业规模经营。培育家庭林场、专业大户、林业合作社等林业新型经营主体近30万个。集体林地产出每亩约300元，比林改前增长3倍多。,深化集体林权制度改革方案的目标是什么？,培育家庭林场、专业大户、林业合作社等新型经营主体,推动林权流转和林业规模经营,使集体林地的产出每亩增长三倍以上,解决单家独户面临的问题,
84,【奥拓电子：公司为华为提供过LED显示解决方案及相关产品】财联社10月12日电，奥拓电子在互动平台表示，公司为华为提供过LED显示解决方案及相关产品。同时，全资子公司南京奥拓自主开发的智能营销播控、智能客户分流等平台应用软件，完成华为及统信的产品适配认证，配合公司自主设计生产的排队机、LCD、LED等硬件产品，服务于金融、通讯、广告等各种需要排队分流和营销互动展示的行业客户。,奥拓电子公司为以下哪家公司提供过LED显示解决方案及相关产品？,华为,统信,南京奥拓,金融客户,
85,"""财联社4月7日电，有投资者问，公司收购三起汽车配件公司完成没有，不是说3月31号过户吗，怎么没有公告？ 联诚精密（002921.SZ）在互动平台表示，公司收购山东三起汽车配件公司的工作正在按照《股权转让协议》约定有序推进（包括但不限于股权交割前的资产验收和债权债务清理等工作），股权交割完成后，我们会及时进行公告。""",联诚精密收购三起汽车配件公司的进展情况如何？,进展顺利，已经完成股权交割,进展正常，但股权交割还未完成,进展缓慢，股权交割预计将延迟,进展困难，收购可能会失败,
86,【何小鹏：与大众集团联合开发的车型已在加速推进】财联社10月12日电，小鹏汽车董事长何小鹏在微博发文称，九月底其拜访了大众集团Wolfsburg总部。何小鹏表示，“过去几个月，我们联合开发的车型已在加速推进，双方的技术团队像一支创业团队一样，为了共同的目标，全情投入、全速前进；在供应链上推进的战略合作，将为我们带来共同降本的潜力。”,小鹏汽车与大众集团联合开发的车型的进展情况如何？,进展顺利，已在加速推进,进展一般，还需更多时间,进展缓慢，有一定的困难,进展失败，合作计划被取消,
87,【欧菲光：公司经营情况正常内外部经营环境未发生重大变化】财联社10月15日电，欧菲光披露股票交易异常波动的公告，截至目前公司经营情况正常，内外部经营环境未发生重大变化。公司未发现近期公共传媒报道了可能或已经对公司股票交易产生较大影响未公开重大信息。,欧菲光的经营环境是否发生重大变化？,经营环境有所改善,经营环境有所恶化,经营环境持续稳定,经营环境波动较大,
88,【通化金马：公司经营情况及内外部经营环境未发生重大变化】财联社10月15日电，通化金马披露股票交易异常波动公告，经核实，公司前期披露的信息未发现需要更正、补充之处。目前公司经营情况及内外部经营环境未发生重大变化。,通化金马公司前期披露的信息是否需要更正、补充？,是的，需要更正、补充,不需要更正、补充,无法确定是否需要更正、补充,经营情况及内外部经营环境发生了重大变化,
89,【氟化工板块震荡走高 联创股份涨超10%】财联社 7月12日电，氟化工板块震荡走高，联创股份涨超10%， 永和股份、 三美股份、 巨化股份、 新宙邦等跟涨。 光大证券研报认为，随着配额战的落幕，制冷剂市场转换为供给端受约束，需求段持续释放的利好局面。第三代HFCs制冷剂在未来占据市场主导地位，价格与价差将迎来大幅上涨空间。,根据资讯，下列哪个公司在氟化工板块中涨幅最高？,联创股份,永和股份,三美股份,巨化股份,
90,【申联生物：与上兽研签署《抗非洲猪瘟的蓝耳病基因工程活载体疫苗技术开发（合作）合同》】财联社10月13日电，申联生物公告，与中国农业科学院上海兽医研究所签署《抗非洲猪瘟的蓝耳病基因工程活载体疫苗技术开发（合作）合同》。双方拟共同开发抗非洲猪瘟的蓝耳病基因工程活载体疫苗，该疫苗能同时预防非洲猪瘟和猪蓝耳病。,申联生物与上兽研签署的合作合同目的是什么？,开发抗非洲猪瘟的蓝耳病基因工程活载体疫苗,开发抗非洲猪瘟的传统疫苗,开发抗猪蓝耳病的基因工程活载体疫苗,开发抗猪蓝耳病的传统疫苗,
91,【凯龙高科：拟转让江苏观蓝20%股权至扬州旭盛邦】财联社9月12日电，凯龙高科公告，公司转让江苏观蓝20%股权至扬州旭盛邦，转让完成后，扬州旭盛邦合计持有江苏观蓝30%股权，该部分股权全部用于对江苏观蓝管理团队以及核心骨干等实施股权激励计划。,以下关于凯龙高科的资讯，哪一个选项是正确的？,凯龙高科将转让江苏观蓝20%股权给扬州旭盛邦,凯龙高科将转让江苏观蓝30%股权给扬州旭盛邦,凯龙高科将转让江苏观蓝40%股权给扬州旭盛邦,凯龙高科将转让江苏观蓝10%股权给扬州旭盛邦,
92,"""财联社1月31日电，有投资者问，请问贵公司运营的游戏都是自己研发的吗？有多少是代理的？ 恺英网络（002517.SZ）在互动平台表示，公司主要业务包括手游与页游等精品娱乐内容的研发、运营及发行，网页游戏平台、移动应用分发平台的运营。公司运营的产品既有自研产品，也有代理产品，具体游戏产品信息，请您关注公司的官网、官微及官方公众号。""",恺英网络的游戏都是自己研发的吗？,是，恺英网络所有的游戏都是自己研发的,否，恺英网络所有的游戏都是代理的,恺英网络既有自研产品，也有代理产品,恺英网络只有代理产品,
93,【大元泵业：与华为、中兴在IDC温控领域推进的屏蔽齿轮泵项目继续深化推进中产品已实现小批量订单】财联社10月12日电，大元泵业在互动平台表示，公司与华为、中兴在IDC温控领域推进的屏蔽齿轮泵项目，相关合作在继续深化推进中。目前该产品已在部分客户中实现有小批量订单，同时我们也关注到，近期行业客户对该款产品的关注度在逐步提升，所接触的客户数量不断增加。,大元泵业在哪个领域推进屏蔽齿轮泵项目？,通信设备领域,温控领域,工业泵领域,客户服务领域,
94,【波兰启用长约200公里的波俄边境墙】财联社10月14日电，波兰内务和行政部长卡明斯基当地时间10月13日宣布，即日起，启用与俄罗斯接壤地带修建的长约200公里的边境墙。卡明斯基表示，边境墙启用后，波方可以全面掌握边境动态，任何非法越境企图都将立即被识别，距离最近的边防人员也将及时采取应对措施。,波兰为什么启用长约200公里的边境墙？,保护国家安全,限制移民人数,增强与俄罗斯的关系,控制边境商品贸易,
95,【伊朗外长阿卜杜拉希扬会见哈马斯领导人哈尼亚】财联社10月15日电，伊朗外交部长阿卜杜拉希扬在卡塔尔首都多哈会见巴勒斯坦伊斯兰抵抗运动（哈马斯）领导人哈尼亚。本次会面是巴以新一轮冲突爆发以来伊朗官员和哈马斯高层之间的首次会面。卡塔尔是伊朗外交部长中东地区之行的第四站。此前，他已访问伊拉克、叙利亚和黎巴嫩，并分别与三国高层及黎巴嫩真主党领导人就巴以局势的最新进展举行会谈。,伊朗外长阿卜杜拉希扬会见哈马斯领导人哈尼亚的首次会面发生在哪个国家？,伊朗,巴勒斯坦,卡塔尔,黎巴嫩,
96,【健康元：艾拉戈利钠片获得药物临床试验批准通知书】财联社10月13日电，健康元公告，公司控股子公司丽珠医药集团股份有限公司(称：丽珠集团)全资子公司丽珠集团丽珠制药厂(称：丽珠制药厂)收到国家药品监督管理局核准签发的《药物临床试验批准通知书》，批准艾拉戈利钠片开展“评价艾拉戈利钠片治疗子宫内膜异位症中度至重度疼痛患者的疗效、安全性的多中心、随机、双盲、安慰剂平行对照期临床试验”。,关于艾拉戈利钠片的临床试验批准通知书，以下哪项说法是正确的？,丽珠制药厂收到了国家药品监督管理局核准签发的《药物临床试验批准通知书》,丽珠制药厂将开展评价艾拉戈利钠片治疗子宫内膜异位症中度至重度疼痛患者的疗效的临床试验,丽珠制药厂将开展随机对照期临床试验,丽珠制药厂将开展安慰剂平行对照期临床试验,
97,"""【 金自天正（600560.SH）：部分工艺模型开发中会用到人工神经网络算法】财联社 2月2日电，金自天正在投资者互动平台表示，公司在2002年取得“人工神经元网络开发平台”计算机软件著作权。目前在部分工艺模型开发中会用到人工神经网络的算法。""",金自天正公司在工艺模型开发中使用到的算法是什么？,人工神经网络算法,遗传算法,模糊逻辑算法,粒子群优化算法,
98,【山西发布霜冻蓝色预警预计最低温度降至0以下】财联社10月12日电，山西省气象台12日10时00分发布霜冻蓝色预警，预警区域：大同、朔州、忻州、吕梁、阳泉北部、晋中东山、临汾北部、长治北部。受冷空气影响，预计未来48小时预警区域内地面最低温度将要下降到0以下，对农业将产生影响。,根据山西省气象台发布的预警，以下哪个地区将有霜冻现象出现？,大同,太原,晋城,吕梁,
99,【中国人民银行行长潘功胜会见美国财政部长耶伦】财联社10月13日电，中国人民银行行长、国家外汇管理局局长潘功胜在摩洛哥马拉喀什出席国际货币基金组织/世界银行年会期间应约会见了美国财政部长耶伦，就两国和世界经济金融形势、发展中国家债务,中国人民银行行长潘功胜会见美国财政部长耶伦的地点是哪里？,沙特,中国,美国,马拉喀什,
100,【英国商人JimRatcliffe在竞购曼联股份的竞争中再度处于领先位置】财联社10月13日电，英国商人JimRatcliffe在竞购曼联俱乐部股份的竞争中再度处于领先位置。曼联董事会称将在未来数天内的会议上讨论收购要约,关于曼联股份竞购的资讯，以下哪个选项是正确的?,曼联董事会已经决定同意Jim Ratcliffe的收购要约,卡塔尔方面已经放弃竞购曼联股份,Jim Ratcliffe目前处于竞购曼联股份的领先位置,曼联俱乐部不打算出售股份,
101,【金凯生科：与诺和诺德的合作涉及减肥产品与礼来的合作不涉及减肥产品】财联社10月13日电，金凯生科在互动平台表示，公司与诺和诺德、礼来保持长期合作，与诺和诺德的合作涉及减肥产品，与礼来的合作不涉及减肥产品。,金凯生科与哪家公司的合作涉及减肥产品？,诺和诺德,礼来,其他公司,没有涉及减肥产品,
102,【哈尔斯：第三季度净利润1.07亿元同比增长102.56%】财联社10月13日电，哈尔斯披露三季度报告，第三季度实现营业收入7.69亿元，同比增长27.67%；净利润约1.07亿元，同比增长102.56%；基本每股收益0.24元。,根据哈尔斯三季度报告，下列哪项数据同比增长超过100%？,营业收入,净利润,基本每股收益,没有数据超过100%的增长,
103,财联社6月19日电，有投资者问，董秘ficonTEC 在光模块领域新增的设备订单有超过 90%的份额都是应用于 800G 光模块设备；请问贵公司有采购ficonTEC 光模块生产设备？博创科技在互动平台表示，公司目前没有采购ficonTEC的设备。,博创科技是否有采购ficonTEC光模块生产设备？,有的,没有的,无法确定,没有提到,
104,【铭利达：公司是华为的一级供应商】财联社10月12日电，铭利达在互动平台表示，公司目前是华为的一级供应商，由于华为涉及行业应用领域较多，目前公司与华为方面保持了密切的沟通和合作，未来具备良好发展前景的行业双方均有可能进行合作。,华为是铭利达的一级供应商吗？,是,否,无法确定,没有提及,
105,财联社7月14日电，有投资者问，公司为比亚迪（002594）供货吗？特别是铜质材料的产品，铜电线这种？铜冠铜箔在互动平台表示，公司主要从事各类高精度电子铜箔的研发、制造和销售等，主要产品按应用领域分类包括 PCB 铜箔和锂电池铜箔，在锂电池铜箔领域客户包括比亚迪（01211.HK）、宁德时代（300750）、国轩高科（002074）等。公司从事少量铜扁线相关产品的生产和销售。,比亚迪（002594）是公司的主要客户吗？,是的，比亚迪是公司的主要客户。,不是，比亚迪不是公司的主要客户。,无法确定，文中没有提到比亚迪的相关信息。,没有提及公司的主要客户,
106,"财联社3月8日电，海天味业（603288.SH）出现1笔大宗交易。成交价格为77.3元,成交金额为850.3万元。买方为中信证券股份有限公司总部(非营业场所)，卖方为中信证券华南股份有限公司广州江南大道证券营业部。无溢价",海天味业（603288.SH）这次大宗交易的买方是谁?,中信证券股份有限公司总部(非营业场所),中信证券华南股份有限公司广州江南大道证券营业部,其他机构或个人,没有提及买方的具体名称,
107,【美国第二大人造钻石生产商WDLabGrownDiamonds申请破产】财联社10月13日电，日前，美国第二大人造钻石生产商WDLabGrownDiamonds根据美国破产法第7章向特拉华州一家破产法庭申请破产保护。该公司表示，其总负债近4400万美元，总资产约为300万美元，估计债权人数量在100至199人之间。,WDLabGrownDiamonds的申请破产保护是因为什么原因?,公司总负债太高,公司总资产太低,债权人数量太多,没有相应的佐证日本旅游作价值,
108,财联社9月5日电，有投资者问，请问贵公司的在煤炭有色等矿产资源领域有哪些技术服务应用？万德斯在互动平台表示，公司在煤炭行业领域主要涉及煤炭行业生产废水零排放治理。煤炭行业生产废水普遍含有多种杂质，成分复杂且处置环境受限，处理难度大，依托公司的膜应用技术、高级氧化技术与蒸发-结晶分盐技术等，可以在满足废水的回用的同时，使废水中硫酸钠等二价盐与氯化钠的分离，实现盐的无害化与资源化回收。,万德斯在煤炭行业领域主要涉及哪方面的技术服务应用？,煤炭行业的安全生产管理,煤炭行业的矿山设计与规划,煤炭行业生产废水零排放治理,煤炭行业的新能源应用,
109,【美国纽约市金融相关岗位数量达逾20年来最高水平】财联社10月13日电，根据美国纽约州审计长ThomasP.DiNapoli周四发布的报告，截至2023年前8个月，纽约证券业平均提供19.51万个就业岗位，他将这种强劲表现归因于2021年创纪录的利润带来的招聘激增。纽约市的证券从业人员数量达20多年来最高水平，但银行业低迷引发的裁员可能会使其中更多人面临风险。,根据报告，纽约证券业岗位数量的增长主要归因于什么原因？,利润的增加,纽约市的人口增长,投资者对证券市场的需求增加,美国经济的复苏,
110,【外交部美大司司长会见“中美经济二轨对话”美方代表团一行】财联社10月12日电，外交部美大司司长杨涛应约会见美国前贸易代表、美中关系全国委员会名誉会长希尔斯和美中关系全国委员会会长欧伦斯率领的“中美经济二轨对话”美方代表团一行。,“中美经济二轨对话”美方代表团一行在中国会见的人是谁？,杨涛,希尔斯,欧伦斯,美国前贸易代表,
111,【美联储12家地区联储 银行（515290.SH；515290.OF）同意一项向公众提供信息的共同政策】财联社 3月25日电，美联储的12家地区联储银行同意了一项针对公众要求提供信息的共同政策，并计划在今年年底前实施这些政策。这12家地区联储银行在纽约联储发布的一份联合声明中表示：“联邦储备银行致力于透明度和问责制，每家地区联储银行都有向公众提供信息的现有程序。”,根据资讯内容，以下哪个描述是正确的？,美联储的12家地区联储银行已经开始向公众提供信息的共同政策。,美联储的12家地区联储银行还在讨论是否向公众提供信息的共同政策。,美联储的12家地区联储银行计划在明年年底前实施向公众提供信息的共同政策。,美联储的12家地区联储银行决定不向公众提供信息的共同政策。,
112,【美亚柏科：华为是公司的战略合作伙伴、供应商及客户】财联社10月12日电，美亚柏科在互动平台表示，华为是公司的战略合作伙伴、供应商及客户，公司围绕战略和业务，与产业链上下游的优秀企业保持着良好的合作关系。,美亚柏科与华为公司的合作关系是什么？,美亚柏科是华为的竞争对手,美亚柏科只是华为的供应商,美亚柏科与华为没有任何合作关系,美亚柏科是华为的战略合作伙伴、供应商及客户,
113,"""【法国巴黎 银行（515290.SH；515290.OF）：美元已经见顶一个多年下跌趋势已开始】财联社 1月10日电，法国巴黎银行分析师表示，美元已经见顶，“一个多年的看跌趋势已经开始”。SamLynton-Brown等策略师在2023年展望报告中写道，美元的下一个大动作将是下跌，而不是上涨。策略师们认为美元还有进一步温和走高的空间，“不过，涨势可能短暂且幅度较浅”。""",根据法国巴黎银行分析师的观点，关于美元走势的判断是什么？,美元将持续上涨,美元将进一步温和走高,美元将大幅下跌,美元将保持相对稳定,
114,【双鹭药业：减肥药周制剂预计明年上半年完成临床研究】财联社10月15日电，双鹭药业在互动平台表示，减肥药周制剂目前正在期临床入组随访中，预计11月份能完成所有受试者的入组工作，明年上半年完成临床研究。该产品主要用于二型糖尿病治疗，次要疗效指标为减轻体重。,双鹭药业的减肥药周制剂研究的预计完成时间是什么时候？,今年年底,明年年底,明年上半年,明年下半年,
115,"""财联社3月20日电，有投资者问，董秘磷矿价格处在高位，对磷酸和磷酸铁等产品利润有影响吗？ 贵公司目前生产销售是否满产满销？ 川恒股份（002895.SZ）在互动平台表示，投资者公司根据市场及其他因素适时提升现有磷酸铁产量。目前公司自产磷矿基本能满足后端产品生产所需，目前生产经营正常。""",以下哪项对川恒股份（002895.SZ）的生产销售情况描写正确？,董秘磷矿价格处在高位，对磷酸和磷酸铁等产品利润有影响。,川恒股份目前生产销售未满产满销。,川恒股份根据市场及其他因素适时提高磷酸铁产量。,目前川恒股份的生产经营并不正常。,
116,【俄罗斯总统与阿塞拜疆总统在吉尔吉斯斯坦举行会谈讨论纳卡局势】财联社10月12日电，俄罗斯总统普京与阿塞拜疆总统阿利耶夫当地时间12日在吉尔吉斯斯坦比什凯克举行会谈，双方主要谈论了纳戈尔诺-卡拉巴赫（纳卡地区）的局势,俄罗斯总统普京与阿塞拜疆总统阿利耶夫在吉尔吉斯斯坦举行会谈，主要谈论了哪个地区的局势问题?,塔吉克斯坦,吉尔吉斯斯坦,阿塞拜疆,纳戈尔诺-卡拉巴赫,
117,【南风股份：公司在手订单正在持续增加】财联社10月13日电，南风股份接受调研时表示，前期受日本福岛事故影响，国内核电站建设放缓，核电领域招标订单确有减少，而近年受益于国内核电重启等的推动，公司在手订单正在持续增加。,南风股份的订单情况是如何的?,受日本福岛事故影响，国内核电站建设放缓，订单减少,近年受益于国内核电重启等的推动，订单持续增加,南风股份的订单量保持稳定，没有明显变化,南风股份的订单呈现波动，有时增加有时减少,
118,【LME金属普跌收跌】财联社10月13日电，LME金属普跌收跌，LME期铜收跌33美元，报7991美元/吨；LME期铝收跌14美元，报2200美元/吨；LME期锌收跌27美元，报2450美元/吨；LME期铅收跌40美元，报2054美元/吨；LME期镍收涨357美元，报18728美元/吨；LME期锡收跌107美元，报24812美元/吨。,以下哪种金属在LME收涨？,铜,铝,锌,镍,
119,【华新环保：拟投资建设高价值贵金属及有色金属提取项目】财联社10月13日电，华新环保公告，拟在安徽铜陵郊区经济开发区境内投资建设“高价值贵金属及有色金属提取项目”，主要生产铜、金、银、镍、锡等产品，项目总投资8亿元人民币。,华新环保计划在安徽铜陵郊区经济开发区投资建设的项目主要生产哪些产品？,铁、锰、钨,铜、金、银、镍、锡,锌、铝、铁,镍、钢、铝,
