id,question,A,B,C,D,answer
113,下列关于风险调整后资本回报率说法不正确的是()。,风险调整后资本回报率是银行进行价值管理的核心指标,风险调整后资本回报率只考虑了预期损失，真实的反映了收益水平，在银行实际收益与所承担的风险之间建立了直接联系,风险调整后资本回报率在银行盈利能力分析中应用日益广泛,风险调整后资本回报率=【(总收入-资金成本-经营成本-风险成本-税项)/经济资本】×100%,
114,下列关于风险监管的说法，不正确的是（）。,监管部门所关注的风险状况包括行业整体风险状况、区域风险状况和银行机构自身的风险状况,银行监管部门通过现场检查和非现场监管等手段，对银行机构风险状况进行全面评估和监控,按照诱发风险的原因，通常可将风险分为信用风险、市场风险、操作风险、流动性风险、国家风险、声誉风险、法律风险以及战略风险八大类,应将监管的重心转移到银行风险管理和外部控制质量的评估上,
115,下列关于个人贷款对象的表述，正确的是（）。,个人贷款的对象仅限于我国公民,个人贷款的对象不能是企业的法定代表人,个人贷款的对象可以是自然人，也可以是法人,个人贷款的对象可以是个体工商户,
116,下列关于个人住房组合贷款的表述，正确的是（）。,商业性贷款与公积金贷款的组合,房屋购置贷款与房屋装修贷款的组合,公积金贷款与个人委托贷款的组合,一手房贷款与二手房贷款的组合,
117,下列关于合同有效性风险中，未履行法定提示义务的说法，错误的是（）。,商业银行作为格式条款的提供方，应当遵循公平原则确定当事人之间的权利和义务,提请借款人注意可在借款合同签订后作出,商业银行应采取合理的方式提示对方注意免除或者减轻其责任等与对方有重大利害关系的条款,法律对“合理的方式提示”并没有明确要求,
118,下列关于混合类理财产品的特点，说法错误的是（）。,通过组合投资，可以进一步分散投资风险，避免某一大类资产配置过于集中的单一市场风险,赋予产品发行主体较大的主动投资管理权限,混合类理财产品不能同时可享受跨市场的投资收益,混合类理财产品在大类资产配置上可进可退，灵活度更大,
119,下列关于计算VAR的方差——协方差法的说法，不正确的是()。,假定投资组合中各种风险因素的变化通常为正态分布,是所有计算VaR的方法中最简单的,反映了高阶非线性特征,反映了风险因素对整个组合的一阶线性和二阶线性影响,
120,下列关于金融资产管理公司监管指标的说法错误的是（）。,法人单一客户业务集中度不高于10%,法人拨备覆盖率不低于150%,法人杠杆率不低于6%,集团合并杠杆率不低于6%,
121,下列关于商业银行对信用风险限额的管理说法错误的是（）,信用风险限额的管理包括结算前信用风险限额和结算信用风险限额,结算前信用风险限额根据交易对手的信用状况计算,结算信用风险限额根据交易工具的实际结算方式计算,结算前信用风险限额根据交易工具的实际结算方式计算,
122,下列关于商业银行和客户在理财顾问服务中的角色的说法中，正确的是()。,商业银行提出建议并做出决策，客户不参与,商业银行只提出建议，最终决策权在客户,客户提出建议并做出决策，商业银行不参与,客户只提出建议，最终决策权在商业银行,
123,下列关于商业银行进行信贷分析的说法中，错误的是()。,银行信贷分析主要采用财务分析和非财务分析两种方法,财务分析偏重于定量分析,非财务分析偏重于定性分析,财务分析主要包括宏观分析、行业分析、经营分析、管理层分析等,
124,下列关于商业银行整存整取定期存款的表述，正确的是（  ）。,期限越长，利率越低,期限越长，利率越高,利率高低与期限长短无关,相同期限，本金越多，利率越低,
125,下列关于行业内竞争程度的说法，正确的是（）。,低经营杠杆增加竞争,具有行业分散特征的行业竞争程度较低,市场成长越迅速，竞争程度越大,退出市场的成本越高，竞争程度越大,
126,下列关于债券违约风险的说法，不正确的是()。,违约风险又称信用风险，是债券发行者不能按照约定的期限和金额偿还本金和支付利息的风险,违约风险一般是由于发行者经营状况不佳、财务状况恶化或信誉不高带来的风险,不同发行者发行的债券违约风险不同,一般来说，国债的违约风险高于公司债券,
127,下列关于中央银行说法错误的是()。,中央银行对法定货币发行权的垄断，决定了最后贷款人功能应该也必须由中行银行来承担,中央银行的营利性和独立性确保了最后贷款人负担的是宏观经济责任而不是微观经济责任,中央银行拥有在贴现、公开市场业务等货币政策工具，能够在流动性缺乏时通过不同的操作方式给予支持,作为银行的银行，中央银行更加易于通过组织其他银行给那些处于困难之中的银行提供协调贷款等方式给予流动性支持,
128,下列机构从业人员中，不属于《银行业从业人员职业操守》必须遵守的内容是（）。,村镇银行工作人员,保险公司工作人员,政策性银行工作人员,农村信用社工作人员,
129,下列事项中，商业银行应予以披露的公司治理信息是（  ）。,风险计量模型建模情况,员工学历结构,基层员工培训情况,独立董事工作情况,
130,下列属于流动性资产的是（）。,债券投资,小额消费信贷,基金投资,活期存款,
131,下列属于商业银行承诺业务的是()。,备用信用证,银行保函,项目贷款承诺,不可撤销信用证,
132,下列行为没有破坏金融管理秩序的是()。,银行工作人员为不符合条件的社会公益组织出具资信证明,银行根据客户的指示，运用客户资金进行债券投资,收买他人信用卡信息资料,某公司根据自身资金需要，吸收社会公众存款,
133,下列选项中，不会引起短期现金需求的是（ ）。,季节性营运资本投资增长,短期的应收账款周转率下降,短期的存货周转率下降,重置部分固定资产,
134,下列选项中，不属于公司的非预期性支出的是（ ）。,法律诉讼费,保险之外的损失,解雇员工产生的费用,原材料采购款,
135,下列选项中，公司发放红利不是合理的借款需求原因的是()。,红利必须发放，但是公司股息发放的压力很大,公司的营运现金流不能满足偿还债务、资本支出和预期红利发放的需要,定期支付红利的公司发展速度无法满足红利支付水平,公司的投资者不愿在经营状况不好时削减红利，股息发放的压力很大,
136,下列选项中，属于商业银行贷款类文件的有（）,企业法人执照,已正式签署的合营合同,借贷双方已正式签署的借款合同,已正式签署的建设合同,
137,下列选项中，通常不用于反映银行经营安全性指标的是（  ）。,资本充足率,存贷比,不良贷款率,拨贷比,
138,下列选项中不属于有利于商业银行合规风险管理基本制度的是（  ）。,合规问责制度,合规绩效考核制度,诚信举报制度,公平竞争制度,
139,下列银行业务中，在申办时不需进行资信审查的是()。,个人生产经营贷款,住房按揭,借记卡,信用卡,
140,下列有关商业银行个人理财业务报告管理的有关问题，说法错误的是（）。,商业银行发售理财计划法实行审批制,商业银行应由主管个人理财业务的高级管理人员对理财计划的报告材料进行审核批准后，报送银监会或其派出机构,商业银行报告的材料不齐全或者不符合形式要求的，应按照银监会或其派出机构的要求进行补充报送或调整后重新报送,商业银行应在理财计划销售文件和宣传材料中提供全面、完整的理财计划相关信息，进行充分的销售前信息披露,
141,下列有关银行同业买入返售（卖出回购）业务的说法，错误的是（）。,该业务项下的金融资产应当为银行承兑汇票、债券、央票等金融资产,卖出回购方不得将业务项下的金融资产从资产负债表转出,买入返售（卖出回购）相关款项在买入返售（卖出回购）金融资产会计科目核算,三方或以上交易对手之间的类似交易应纳入买入返售或卖出回购业务管理和核算,
142,下列资产中，无法使用市场价值法确定价值的是（）。,股票,外汇,期货,贷款,
143,现代管理学认为，组织架构是由工作任务、工作流程、汇报关系和()所组成的一个系统。,交流渠道,投诉管理,风险管理,财务管理,
144,限制人身自由的行政法规，只能由（）规定。,行政法规,地方性法规,刑法,法律,
145,小王是某银行的理财经理，目前该行新推出了一款非保本浮动收益理财产品。在此之前该行有一款与之类似的产品年回报率已实现5%，于是小王向客户介绍:“该产品是一款投资理财产品，预期收益大约为5%。”下列对该行为表述正确的是（  ）。,小王的介绍突出了该产品的优势，且进行了有效的风险提示，客户更容易接受,小王的介绍透露了银行产品的内部信息，违反了商业保密原则,小王绍简明扼要，抓住了产品的特点，值得借鉴,历史不能代表未来，小王的推荐容易误导客户，违反了销售人员应客观、真实地向客人介绍银行产品和服务的原则,
146,薪酬中的()会给退休规划提供更多收入保障，如延期收入中的福利部分如企业年金、社会保险等可以为客户提供一部分退休金，是退休生活的收入来源之一。,当期收入,福利,津贴,延期收入,
