id,question,A,B,C,D,answer
213,关于国有股权非上市转让的特殊要求，说法正确的是(),各级人民政府负责审核国有企业的股权转让事项,股权转让事项经批准后，由转让方委托会计师事务所对转让标的企业进行审计,股权转让原则上通过二级市场公开进行,交易价款原则上应当自合同生效之日起5个工作日内一次付清，不可分期付款,
214,上海证券交易所固定收益平台的交易时间段是()。,9：30-11：30、13：00-15：00,9：30-11：30、13：00-14：00,9：30-11：30、13：00-15：30,9：15-11：30、13：00-14：00,
215,目前银行债券市场债券结算主要采用()的形式。,纯债券过户,见券付款,见款付券,券款对付,
216,目前，我国银行间市场债券结算业务类型不包括()。,现券业务,买断式回购业务,利率互换,债券借贷,
217,我国银行间债券市场的现券交易品种不包括()。,企业债,资产支持证券,超短期融资债券,可转债,
218,关于基金资产估值需要考虑的因素，以下表述错误的是()。,交易活跃的证券，通常采用市价估值,交易所上市的股指期货合约以估值当日结算价进行估值,海外基金的股指频率较低，一般是每月估值一次,我国封闭式基金每个交易日估值，每周披露一次份额净值,
219,复核无误的及基金份额净值，由()对外公布。,基金管理人,基金托管人,基金销售机构,基金注册登记机构,
220,关于期货市场的作用，以下表述错误的是()。,提供分散、转移价格风险的工具，有助于稳定国民经济,农产品期货市场有助于减缓农产品价格波动对农业发展的不利影响,期货交易需要对大量信息进行加工，故期货交易形成的未来价格信号具有滞后性,期货交易所形成的未来价格信号能反映多重生产要素在未来一定时期的变化趋势,
221,互换合约是指交易双方约定的在未来某一期间内交换他们认为具有相等经济价值的()的合约。,证券,股票,现金流,债券,
222,以下那一项不是识别有效投资组合的必要信息?(),每种证券的期望收益率,每种证券的收益率的方差,每种证券的风险属性,每一种证券与其他证券之间的相关关系,
223,关于权益类证券投资风险收益，以下表述错误的是()。,无论是系统风险还是非系统风险，都要求相应的风险溢价,风险资产期望收益率=风险资产收益率+风险溢价,风险较高的公司对应较高的风险溢价，其期望收益一般也较高,在其他条件都相同的情况下，股票投资者对风险更高的公司出价更低，要求的期望收益率更高。,
224,资源配置策略中的买入并持有策略对市场流动性的要求( )。,较高,适中,较低,极高,
225,证券投资基金诞生于( )。,美国,英国,德国,法国,
226,开放式基金是通过投资者向( )申购或赎回实现流通的。,基金托管人,基金受托人,基金管理公司,证券交易市场,
227,时间加权收益率反映了( )在不取出的情况下的收益率，其计算将不受分自影响。,分红再投资,1元投资,100元投资,基金份额净值投资,
228,在二级市场买卖ETF时，申报价格最小变动单位为( )。,0.0001元,0.001元,0.1元,0.01元,
229,基金招募说明书的内容不包括以下( )方面。,风险警示内容,基金份额发售方式,基金合同摘要,基金持有人结构及前十名基金持有人,
230,通常，基金管理公司内部制定和监督执行风险控制政策的机构是( )。,投资决策委员会,风险控制委员会,董事会,基金份额持有人大会,
231,根据有关规定，基金管理人应当自收到核准文件之日起( )个月内进行开放基金的募集。,2,3,1,6,
232,( )是衡量一个基金经营好坏的主要指标，也是基金单位交易价格的，计算依据。,基金规模,基金收益率,基金资产净值,基金赎回率,
233,( )阶段是基金托管人全面行使职责的阶段。,签署基金合同,基金终止,基金运作,基金募集,
234,积极型股票投资战略的重要标志之一是( )。,相机抉择,指数化投资,长期持有,投资高风险高收益的产品,
235,一般来说，资产配置的情景综合分析法的预测区间为( )。,9～10年,6～8年,3～5年,1～2年,
236,在契约型基金的运作关系中，处于核心地位的是( )。,基金管理人,基金托管人,基金监管机构,基金持有人,
237,我国基金管理公司全部为( )。,有限责任公司,股份有限公司,股份公司,合伙公司,
238,目前，我国开放式基金的最低认购金额一般为( )人民币。,10000元,5000元,I000元,100元,
239,下列基金类型中，实行实物申购、赎回机制的是( )。,ETF,货币基金,LOF,封闭式基金,
240,基金会计核算的责任主体是( )。,基金持有人大会,基金监管部门,基金持有人,基金管理公司,
241,消极债券组合的管理者通常把( )看作均衡交易价格。,买l方报价,卖方报价,市场价格,债券面值,
242,已知基金的平均收益率、平均无风险利率和标准差，可以计算( )。,特雷诺指数,詹森指数,M2测度,夏普指数,
243,关于货币市场基金的说法，正确的是( )。,只适合长期投资,只适合短期投资,没有投资风险,既适合短期投资，也适合长期投资,
244,下列基金类型中，投资风险最高的是( )。,混合基金,股票基金,货币市场基金,债券基金,
245,( )是指执行基金管理人的投资指令，办理基金名义的资金来往的结算账户。,资产保管,资金清算,资产核算,资金交割,
246,不主动寻求取得超越市场的表现，而是试图复制某一市场表现的基金是( )。,收入型基金 请访问考试大网站/,平衡型基金,指数型基金,成长型基金,
247,基金上市交易公告书的编制主体是( )。,基金管理人,基金托管人与基金管理人,基金托管人,基金份额持有人,
248,乖离率(BIAS)是技术分析指标之一，它属于( )。,摆动型指标,震荡型指标,量能指标,超买超卖型指标,
249,基金清算账册以及有关文件由( )来保存。,基金托管人,基金发起人,基金管理人,基金清算小组,
250,债券基金投资风格主要依据基金所持债券的( )来划分。,凸度,收益,久期与信用等级,发行人,
251,下列不属于基金市场营销特殊性的是( )。,持续性,营利性,专业性,服务性,
252,( )对威廉?夏普的资本资产定价模型(CAPM)的可检验性提出了质疑，并提出了替代的套利定价模型。,马柯威茨,詹森,法玛,罗斯,
253,( )，证券投资基金在世界范围内得到普及性的发展。,20世纪90年代末,20世纪80年代以后,20世纪60年代以后,20世纪40年代以后,
254,基金管理人、基金托管人等有关信息披露义务人编制临时报告书，经( )核准后予以公告，同时报告中国证监会。,基金上市的证券交易所,基金份额持有人大会,中国人民银行,证券业协会,
255,甲投资者投资10000元认购基金，假设管理人规定的认购费率为1%，则其可得到的认购份额为( )份。,9900,9901,9900.99,10000,
256,证券投资基金市场营销的中心是( )。,确定目标客户,扩大销量,利润最大化,分割市场,
257,目前，我国货币型基金的认购费率一般为( )。,1%～5%,1%以下,5%以下,0,
258,ETF基金份额折算比例以四舍五入的方法，保留小数点后( )。,2位,5位,7位,8位,
259,基金管理公司的独立董事人数不得少于( )。,2人,3人,5人,10人,
260,市场竞争越激烈，基金费率通常( )。,越高,越低,波动越大,无变化,
261,采用( )策略时，股价上升卖出股票，股价下跌买人股票。,战略性资产配置,恒定混合策略,战术性资产配置,投资组合保险策略,
262,市盈率和市净率是基本分析的重要指标，某公司的股价为20元，每股净利润为0.5元，每股净资产为5元，其市盈率和市净率分别为( )。,30;5,40;4,10;2.5,15;10,
263,( )是指基金托管人依据相关法律法规，对基金管理人的估值结果即基金份额直、累计基金份额净值以及期初基金份额净值进行的核对。,基金财务的复核,基金头寸的复核,基金资产净值的复核,基金财务报表的复核,
264,我国证券投资基金托管费以( )为基础计提。,基金资产总额,基金资产净值,基金发行规模,固定金额,
265,下列关于资本市场线的说法，不正确的是( )。,资本市场线反映的是有效资产组合的期望收益率与风险程度之间的关系,资本市场线上的各点反映的是单项资产或任意资产组合的期望收益与风险程度之间的关系,资本市场线反映的是资产组合的期望收益率与其全部风险间的依赖关系,资本市场线上的每一点都是一个有效资产组合,
266,投资者在股价上升时买入股票，股价下跌时卖出1股票。其采用的是( )。,战略性资产配置策略,恒定混合策略,战术性资产配置策略,投资组合保险策略,
267,下列有关道氏理论的说法，正确韵是( )。,证券市场价格波动由长期波动和短期波动两种趋势构成,开盘价最重要,交易量与价格没有关系,证券市场价格波动由主要趋势、次要趋势和短暂趋势三种趋势构成,
268,下列属于基金首次募集披露的信息是( )。,基金份额上市交易公告书,基金资产净值,基金年度报告,基金份额发售公告,
269,根据有效市场假说，在( )内，证券价格可以及时的反映所有信息。,半弱势有效市场,半强势有效市场,强势有效市场,弱势有效市场,
270,( )是指应计收益率每变化1个基点时引起的债券价格的绝对变动额。,价格变动收益率值,基点价格值,麦考莱久期,修正久期,
271,确定资产类别收益预期的主要方法是( )。,风险收益法,情景综合分析法,界面法,成本收益法,
272,下列有关组合型消极投资策略的说法，正确的是( )。,该策略重点是进行风险控制,是一种以现实市场投资组合业绩为’管理目标的投资组合,可以扩展到基金型股票投资策略的实施过程中,不试图用基本分析的方式来区分价值高估或低估的股票,
273,用于衡量投资者持有债券的变现难易程度的风险是( )。,利率风险,再投资风险,流动性风险,赎回风险,
274,在证券投资基金信托关系中，( )是基金资产的监护人。,基金管理人,基金托管人,基金公司,基金董事会,
275,( )反映了两个证券收益率之间的走向关系。,证券投资组合的期望收益率,协方差,证券各自的方差,证券各自的权重,
