id,question,A,B,C,D,answer
113,机构甲为股权投资基金管理人，机构乙为股权投资基金财产保管机构，机构丙为管理人委托的基金份额登记机构，以下属于该基金服务机构的是()。,丙,乙,甲、乙、丙,乙、丙,
114,以下分配方式符合合伙型股权投资基企“瀑布式收益分配体系”的是(),按照约定门槛收益率，先分配门槛收益给所有合伙人，然后返还本金，分配超额收益,先向有限合伙人返还本金和门槛收益，然后向普通合伙人返还本金，分配超额收益,按照约定门尴收益率，先分配门槛收益给有限合伙人，再返还本金，然后向普通合伙人返还本金和分配超额收益,先问所有合伙人返还本金，再按照约定门尴收益率向所有合伙人分配门槛收益，然后分配超额收益,
115,签署投资备忘录属于股权投资基金运作的()阶段。,管理,设立,募集,投资,
116,在确定杠杆收购中自有资金与外部资金的比例时，通常不需要考虑的是(),目标公司的现金流,目标公司的同业竞争情况,资本结构的风险,外部资金的融资成本,
117,关于创投基全与并购基金的区别，以下表述错误的是(),创投基金通常不使用杠杆;并购基金通常使用杠杆,创投基金采取参股投资;并购基全采取控股投资,创投基金只投资早期企业;并购基金只投资成熟企业,创投基金投后重点是增值服务;并购基金投后重点是企业重整,
118,股权投资基金为被投资企业提供增值服务，以下表述错误的是(),对于发展较为成熟的被投资企业，增值服务侧重在资源导入、兼并收购、上市推动等方面,对于早期阶段的被投资企业，增值服务侧重在规范管理、业务开拓、后续再融资等方面,主要目的是提升被投资企业的价值，降低投资风险，最终实现投资机构对被投资项目的顺利退出,协助被投资企业进行后续再融资工作，以便投资机构能够参与被投资企业的后续轮次融资,
119,关于完全棘轮条款，以下表述正确的是()。,完全棘轮条款充分考虑了新发行股权的数量,完全棘轮条款是容易被企业(尤其是创始股东)一级投资人各方接受的一种反摊薄条款,完全棘轮条款在创业投资基金中比较常见，适用于被投企业后续融资估价升高的情形,完全棘轮条款比加权平均条款能更大限度地保护投资人,
120,每个会计年度结束后4个月内，北京某股权投资基金管理人应当向()报送经会计师事务所审计的年度财务报告。,中国证券投资基金业协会,中国证券业协会,中国证券监督管理委员会,北京股权投资基金协会,
121,关于合伙型股权投资基金，以下表述错误的是()。,本质上是种合伙关系,有限合伙企业是企业所得税的纳税主体,普通合伙人既可以自任基金管理人，亦可以委托第三方任基金管理人,有利于避免双重纳税,
122,关于企业的现金流，以下表述错误的是(),投资获得产生的现金流包括正常生产经营活动投资的短期资产以及企业投资所产生的股权与债权,企业净现金流可以通过现金流量表反映，主要包括经营活动，投资活动和筹资活动产生的现金流,筹资活动产生的现金流反映企业长期资本筹集资金状况,经营活动产生的现金流是与生产商品、提供劳务、缴纳税金等直接相关的业务所产生的现金流量,
123,2018年6月12日某投资者以5元买入A股票1000股，并以20元价格卖出B股票5000股，该投资者缴纳的印花税为()元。,100,220,115,20,
124,关于期货合约，以下表述错误的是(),金融期货合约的交割大多采用现金结算,盯市制度对保证期货合约的履行非常重要,期货合约是非标准化合约,投机者是期货市场的重要组成部分,
125,关于中证全债指数，以下表述错误的是(),中证全债指数为债券投资者提供了投资分析工具和业绩评价基准,中证全债指数是由中证指数有限公司编制,中证全债指数的一个重要特点在于对异常价格的无价情况下使用了最近收盘价,中证全债指数是综合反映银行间债券市场和沪深交易所债券市场的跨市场债券指数,
126,在股价指数的编制中，按样本股票在市场上的不同成交金额赋予不同的权数的编制方法称为()。,其他三项均不是,算术平均法,加权平均法,几何平均法,
127,关于货币市场工具，以下表述正确的是(),定期存款因为不能随时支取，所以不属于货币市场工具,货币市场工具是高流动性高风险的证券,货币市场工具交易形成的利率一般不作为市场的基准利率,货币市场工具为商业银行管理流动性提供了有效的手段,
128,关于均值、方差模型，以下表述错误的是()。,无差异曲线是在期望收益标准差平面上由相同给定校用的所有点组成的曲线,市场上可投资产所形成的所有组合成为可行集,无差异曲线和有效前沿相切的点所代表的投资组合成为最优组合,从全局最小方差组合开始，最小方差前沿的下半部分就成为有效前沿,
129,下述选项中不可以进行回转交易的是()。,权证交易,股次交易日起,债券竞价交易,单市场股原型ETF,
130,投资交易中的操作风险是指()。,由于汇率变动所产生的基金价值的不确定性,由于人员、流程、系统或外部因素带来的交易失误，导致基金资产或基金公司遭受损失的风险,由于宏观政策的变化导致的对基金收益的影响,由于违反法律、法规、交易所规则、基金合同所导致公司遭受损失的风险,
131,关于基金交易业务控制，下列说法错误的是()。,基金经理可以直接向交易员下达投资指令或者直接进行交易,建立交易监测系统、预警系统和交易反馈系统，完善相关的安全设施,公司应当执行公平的交易分配制度，确保不同投资者的利益能够得到公平对待,建立完善的交易记录制度，每日投资组合列表等应当及时核对并存档保管,
132,基金管理公司岗位分离制度不包括()。,交易与清算的分离,基金会计与公司会计的分离,投资与交易的分离,清算与核算的分离,
133,内幕交易和操纵市场行为违反了证券市场的()原则。,公开、公平、公正,及时、客观、准确,高效、全面、及时,客观、全面、准确,
134,基金管理人董事会可以下设()，负责对公司经营管理与基金运作的风险控制及合法合规性进行审议、监督和检查，草拟公司风险管理战略，评估公司风险管理状况。,风险管理部,合规管理部,合规与风险管理委员会,合规与风险控制部,
135,2007年，中国证券业协会设立了()，负责联络与业务交流工作。,基金公会,证券投资基金业委员会,基金公司会员部,基金业行会,
136,衡量价格收益率曲线弯曲程度的指标是()。,久期,凸度,风险,凹凸性,
137,在货币市场上占有重要地位的国债是()。,无期限国债,长期国债,国库券,短期国债,
138,下列关于地产投资的表述，错误的是()。,不确定性非常高,投资价值受法律法规影响较小,具有较高的投机性,投资价值受宏观环境影响较大,
139,马可维茨用来衡量投资者所面临的可能收益与预期收益偏离程度的指标是()。,收益率的高低,收益率低于期望收益率的频率,收益率为负的频率,收益率的方差,
140,下列关于欧盟《另类投资基金管理人指令》(AIFMD)对于私募股权投资基金的“资产剥离”规定，说法正确的是()。,私募股权投资基金收购公司1年内不许通过分红、减持、赎回等形式进行资产转让,私募股权投资基金收购公司2年内不允许通过分红、减持、赎回等形式进行资产转让,私募股权投资基金持有公司30%及以上股权时，应确保公司董事会向员工通报此持股情况,私募股权投资基金持有公司20%及以上股权时，应向公司及其他股东进行披露,
141,分析()有助于投资者估计今后企业的偿债能力、获取现金的能力等。,资产负债表,利润表,现金流量表,所有者权益变动表,
142,债券年利息收入与当期债券市场价格的比率，为()。,到期收益率,当期收益率,信用利差,债券收益率,
143,下列关于证券交易所的说法，错误的是()。,是实行自律管理的法人,享有交易所业务规则制定权,负责对基金在场内场外的投资交易活动进行监管,设有基金交易监控系统，重点监控涉嫌违法违规的交易行为,
144,以下不属于基金管理公司制定内部控制制度的原则的是()。,合法、合规性原则,全面性原则,审慎性原则,成本效益原则,
145,我国基金信息披露的规范性文件中，基金信息披露编报规则不包括()。,交易的业务规则的编制及披露,财务会计报告的编制与披露,投资组合报告的编制及披露,基金净值表现的编制及披露,
146,目前，证券投资基金的主流产品是()。,封闭式基金,开放式基金,公募基金,私募基金,
147,长期以来，我国居民的偏爱()。,货币储蓄,投资,融资,借贷资金,
148,以下关于一篮子股票组合的股票基金的说法，正确的是()。,每一交易日股票基金不只有一个价格,股票基金份额净值不会由于买卖基金数量或申购、赎回数量的多少而受到影响,对股票基金份额净值高低进行合理与否的判断是有意义的,投资风险高于单一股票的投资风险,
149,()是指基金从业人员通过主动自觉的自我学习、自我改造、自我完善，将基金职业道德外在的职业行为规范化为内在的职业道德情感、认知和信念，使自己形成良好的职业道德品质和达到一定的职业道德境界,基金职业道德教育,基金职业道德修养,道德,职业道德,
150,为单一客户办理特定资产管理业务的，客户委托的初始资产不得低于()人民币。,1000万元,200万元,3000万元,500万元,
151,下列关于商业票据发行的说法错误的是()。,商业票据的发行包括直接发行和间接发行两种,大多数资信好的公司采用间接发行方式,商业票据采用贴现发行的方式,货币市场利率越高，贴现率越高;发行主体资信越好，贴现率越低,
152,在报价驱动市场中处于关键性地位的是()。,做市商,经纪人,个人投资者,机构投资者,
153,当市场利率()时，债券发行人能够以更低的利率融资，因此可能会提前偿还高息债券，以降低企业融资成本。,下降,上升,波动较大,波动较小,
154,交易所在制定标的资产的等级时，常采用国内或国际贸易中()作为标准交割等级。,按期货合约规定的标准质量等级,不需要任何标准品,标准品较小的质量等级,最通用和交易量较大的标准品的质量等级,
155,如果X的取值无法一一列出，可以遍取某个区间的任意数值，则称为()。,离散型随机变量,分布型随机变量,连续型随机变量,中断型随机变量,
156,按执行价格和标的资产市场价格关系分类，期权可分为()。,看涨期权和看跌期权,欧式期权和美式期权,期货期权和利率期权,实值期权、虚值期权和平价期权,
157,下列关于我国QDII基金产品的特点的说法，错误的是()。,QDII基金的投资范围较为广泛,QDII基金的投资组合较为丰富,在投资管理过程中具有完全的主动决策权，体现出专业性强、投资更为积极主动的特点,QDII基金产品的门槛较高,
158,技术分析方法长期以来一直是投资决策的()。,核心工具,辅助工具,关键工具,主要工具,
159,基金经理的投资策略与投资风格不同，通过基金业绩评价有助于帮助基金公司更好地量化分析基金经理的业绩水平，为()提供参考。Ⅰ.投资目标匹配Ⅱ.投资计划实施Ⅲ.内部绩效考核Ⅳ.保全投资资本,Ⅰ、Ⅱ、Ⅳ,Ⅰ、Ⅲ、Ⅳ,Ⅰ、Ⅱ、Ⅲ,Ⅰ、Ⅱ、Ⅲ、Ⅳ,
160,()一些小型的私人资产投资以及小型企业对私募的接触使PE得到起步。,1946～1981年,1955～1978年,1942～1983年,1936～1966年,
161,私募基金应当向合格投资者募集，单只私募基金的投资者人数累计不得超过()等法律规定的特定数量。Ⅰ.《证券投资基金法》Ⅱ.《合伙企业法》Ⅲ.《公司法》Ⅳ.《私募投资基金监督管理暂行办法》,Ⅰ、Ⅱ、Ⅲ,Ⅰ、Ⅱ、Ⅳ,Ⅱ、Ⅲ、Ⅳ,Ⅰ、Ⅲ、Ⅳ,
162,()是指一家非上市公司通过把资产注入一家已上市公司，从而得到该公司一定程度的控股权，利用其上市公司地位，原非上市公司得以间接上市。,直接上市,重新上市,间接上市,控股上市,
163,以下处罚措施，错误的是()。,证券监督管理机构工作人员玩忽职守、滥用职权、徇私舞弊或者利用职务的便利索取或者收受他人财物的，依法追究刑事责任,拒绝、阻碍证券监督管理机构及其工作人员依法行使监督检查、调查职权未使用暴力、威胁方法的，依法给予治安管理处罚,违反法律、行政法规或者国务院证券监督管理机构的有关规定，情节严重的，国务院证券监督管理机构可以对有关责任人员采取证券市场禁入的措施,违反《证券投资基金法》规定，构成犯罪的，依法追究刑事责任,
164,2号《私募投资基金合同指引》适用于哪种基金类型()。,公司型,契约型,合伙型,私募型,
165,根据()规定，任何机构或个人不得向非合格投资者募集、销售、转让私募产品或者私募产品收益权。,《合伙企业法》,《私募基金募集行为管理办法》,《证券投资基金法》,《公司法》,
166,有限合伙型按照合伙协议的规定有一个经营期限，一般为()年，期限届满时，利润要进行全额分配。,7,5,3,10,
167,以下关于财务尽职调查的说法，不正确的是()。,财务尽职调查重点关注标的企业过去的财务业绩情况,强调发现企业的流动性价值和潜在风险,注重对企业未来价值和成长性的合理预测,经常采用趋势分析和结构分析工具,
168,成本法包括账面价值法和()。,预估模型法,财务成本法,现金流法,重置成本法,
169,()，国务院发布《国务院关于促进创业投资持续健康发展的若干意见》。,42583,42614,42248,42217,
170,假设市场组合预期收益率为3%，无风险利率为1%，如果该股票的β值为2，则该股票的预期收益率与市场组合预期收益率之差为()。,0.02,0.03,0.04,0.05,
171,某投资组合p与市场收益的协方差是3，市场收益的方差是2，该投资组合的贝塔系数是()。,2,3,1.5,1,
172,风险敞口是对风险因子的暴露程度，可以通过多个维度测量风险敞口。例如，一个全球投资组合，从国家角度看，投资于美国市场的比例为50%，那么这个组合对美国市场的风险敞口为()。,0.1,0.5,0.3,1,
173,在风险程度上，按照理论推测和以往的投资实践，证券投资中风险最大的是()。,基金投资,债券投资,股票投资,国债投资,
174,()不可以开立基金账户。,16岁个体小王,17岁在读大学生,23岁应届毕业生,65岁退休干部小李,
175,下列关于常用的寻找潜在客户的方法，说法正确的是()。,缘故法是利用营销人员个人的生活与工作经历所建立的人际关系进行客户开发,缘故法是通过现有客户介绍新客户，主要针对间接客户型群体,介绍法利用营销人员个人的生活与工作经历所建立的人际关系进行客户开发,采用陌生拜访法的不足之处在于营销人员无法逐步建立属于自己的营销网络,
176,关于基金信息披露的表述，不正确的是()。,加强基金信息披露可以改变投资者的信息弱势地位,基金信息披露有利于投资者的价值判断,加强基金信息披露可以防止信息的滥用,基金信息披露是一种自愿性信息披露,
177,基金年度报告在会计年度结束后()日内经过审计后予以公告。,10,25,45,90,
178,下列关于证券投资基金说法正确的是()。,基金评价机构对证券投资基金进行评价无需通过公开形式发布基金评价结果,晨星资讯Moringstar是中国获得首批基金评奖业务资格的机构,2011年5月中国证券报社获得首批基金评奖业务资格,2003年2月20日晨星资讯中国总部在深圳成立,
179,证券登记结算机构的职能不包括(),制定交易规则，维护交易秩序,证券持有人名册登记及权益登记,证券账户、结算账户的设立和管理,证券和资金的清算交收及相关管理,
180,关于衍生品的交易场所，以下说法错误的是(),期货合约只在交易所交易,互换合约常在场外交易,期权合约只在交易所交易,远期合约常在场外交易,
181,关于基金公司投资交易流程，以下表述错误的是(),基金经理可以直接向交易员下达交易指令,基金公司投资交易流程包括风险控制环节,交易员必须严格遵照公司公平交易制度执行交易指令,交易员收到投资指令后有权选择适当时机完成指令,
182,下列选项不能直接从财务报表获得的是(),经营活动产生的现金流量,净利润,所有者权益,净资产收益率,
183,基金托管人对基金资产估值负有()责任,复核,监督,直接估值,披露,
184,由某个或少数的某些资产有关的一些特别因素导致的风险，被称之为(),单体风险,系统性风险,非系统性风险,人为风险,
185,根据我国证券市场有关规定，除权，除息日为(),A股、B股的权益登记日的次日,A股、B股的权益登记日的次一交易日,A股的权益登记日(B股的最后交易日)的次日,A股的权益登记日(B股的最后交易日)的次一交易日,
186,关于中位数，以下说法错误的是(),有时候一组样本有两个中位数,-组样本有一个中位数,通常用中位数来作为评价基金经理业绩的基准,中位数是上50%的分位数,
187,基金从业资格考试报名入口11关于均值/中位数与分位数，以下说法错误的是(),对同一组数据来说，中位数就是大小处于正中间位置的那个数值,有些时候，一组数据的均值与中位数相同,中位数就是上50%分位数,投资管理领域中，均值经常被用来作为评价基金经理业绩的基准,
188,基金在场内进行投资交易，需要支付的交易结算费用中不包括(),经手费,证券交易所交易监管费,过户费,申购赎回费,
189,关于期货合约和期权合约，以下说法错误的是(),期货合约具有杠杆效应，期权合约也具有杠杆效应,期货合约是双边合约，期权合约也是双边合约,期货合约的损益对称，期权合约的损益不对称,期货合约在交易所交易，期权合约大部分在交易所交易,
190,我国封闭式基金的估值频率是(),每个交易日,每月,每周,每半个月,
191,关于优先股/普通股和债券的投票权和清顺序，以下表述错误的是(),公司合并/分离/解散等需要股东投票表决通过,普通股股东有分配盈余及剩余财产的权利,公司债券持有人对公司事务没有表决权,优先股股东拥有公司资产的最高索取权,
192,已知某公司的净资产收益率是15%，销售利润率为5%，总资产周转率是2，那么该公司的负债比率为(),0.33,1.5,0.5,0.16,
193,交易所上市交易的债券一般按照哪一种价格进行估值(),第三方估值机构提供的当日估值净值,成本价,交易所市价,交易所收盘价,
194,关于保险资金投资表述错误的是(),通常寿险公司的投资期限比产线的投资期限长,财产险通常投资于低风险资产,保险资产的主要来源是保费收入,保险资金投资范围不包括不动产,
195,基金从业1对基金估值结果负有复核责任的是(),基金管理人,律师事务所,会计事务所,基金托管人,
196,主动投资的目标不包括()。,缩小主动风险,缩小跟踪误差,提高信息比率,扩大主动收益,
197,×年×月×日，某基金公告利润分配，每10股配0.2元，权益分配日(除权除息)某投资者持有该10000份，未进行除息时份额净值为1.222元，则除权息后份额净值和该投资者持有的基金份额分别为()。,1.202，10000,1.220，10000,1.022，9800,1.222，10000,
198,基金份额净值是计算投资者申赎基金的基础，那么基金份额净值是通过以下哪种计算公式得出(),资产净值/前日基金份额,总资产/前日基金份额,总资产/当日基金份额,资产净值/当日基金份额,
199,进行基金产品风险评价时，应当依据的因素不包括()。,基金的过往业绩及基金净值的历史波动程度,基金托管人的资本金规模,基金的历史规模和持仓比例,基金招募说明书所明示的投资方向、投资范围和投资比例,
200,ETF的买入申报数量为()份或其整数倍。,100,50,10,5,
201,体现依法监管原则的行为包括()Ⅰ.监管机构的设置及其监管职权的取得，必须有法律依据Ⅱ.监管职权的行使，必须依据法律形式Ⅲ.对法律行为的制裁，必须依据法律的明确规定,Ⅰ、Ⅱ,Ⅰ、Ⅲ,Ⅰ、Ⅱ、Ⅲ,Ⅱ、Ⅲ,
202,关于非公开募集基金管理人登记的描述，以下错误的是(),降低了非公开募集基金管理人设立难度和设立成本,体现了国家对公开募集基金和非公开募集基金的区别监管理念,有利于非公开募集基金的灵活操作,中国证券投资基金业协会依据中国证监会的授权对非公开募集基金管理人进行统一监管,
203,以下没有汇率风险的是(),货币ETF,港股通,QDII,QFII,
204,根据相关法规，私募投资基金可以投资的金融品种包括()Ⅰ.上市公司股票Ⅱ.交易所债券Ⅲ.银行间债券Ⅳ.证券投资基金,Ⅰ、Ⅱ、Ⅳ,Ⅰ、Ⅱ、Ⅲ、Ⅳ,Ⅰ、Ⅱ、Ⅲ,Ⅱ、Ⅲ、Ⅳ,
205,关于LOF和ETF的区别，以下表述错误的是(),ETF的申购和赎回通过交易所进行，LOF的申购和赎回可以通过销售机构和易所进行,在二级市场的净值报价频率上，ETF通常比LOF高,ETF通常采用完全被动式管理方式，LOF可以使被动管理型基金也可以是主动管理型基金,ETF的申购和赎回是基金份额与现金的对价，LOF的申购和赎回与投资者交换的是基金份额与一篮子股票,
206,关于基金外包服务，以下表述错误的是()。,外包机构均应到中国证券投资基金业协会备案,基金份额登记属于基金核心业务，不应进行外包,在监理必要业务隔离的前提下，可以委托同一家机构对基金进行估值核算和托管,基金管理人可以委托外包机构从事基金销售业务,
207,投资者不得非法汇集他人资金投资于股权投资基金，以下对这一类表述理解错误的是()。,投资者不能以规避合格投资者标准为目的汇集他人自己投资于股权投资基金,投资者不能以规避合格投资者标准为目的将股权投资基金份额进行拆分,多个个人投资者以私下签订协议的形式汇集资金后，可以将汇集后的自己以个人名义投资股权投资基金,通过合伙企业、契约等非法人形式汇集多人资金用于投资股权投资基金时，应确保所有投资者均符合合格投资者标准,
208,中国证券投资基金业协会对股权投资基金行业开展行业自律，应依照()。Ⅰ、《证券投资基金法》Ⅱ、《私募投资基金监督管理暂行办法》Ⅲ、《私募投资基金募集行为管理办法》Ⅳ、《关于进一步规范私募基金管理人登记若干事项的公告》,Ⅰ、Ⅱ、Ⅲ,Ⅰ、Ⅱ、Ⅲ、Ⅳ,Ⅰ、Ⅱ、Ⅳ,Ⅰ、Ⅱ,
209,"关于贴现现金流法的两种模型,以下说法正确的是()",公司的内在价值等于未来各年公司自由现金流量用权益资本成本贴现得到的现值之和,公司自由现金流量是归属于公司股东的现金流量,"股权自由现金流量贴现模型中,股权的内在价值等于未来各年股权自由现金流量用公司的加权平均资本贴贴现得到的现值之和",股权自由现金流量指公司经营活动产生的现金流量在扣除业务发展的投资需求和对其他资本提供者的分配之后能够分配给股东的现金流量,
210,股权投资协议中，关于排他性条款错误的是()。,一般是投资分单边选择权的条款,在排他条款结束日期后，融资方可以拒绝现有投资方，与其他投资方达成交易意向,排他期间，融资方不能与其他投资分洽谈，但融资方子公司可以与其他投资方洽谈融资,在规定时间内，投资分有权决定是否投资,
211,股权投资基金管理人于每年度四月底之前通过股权投资基金登记备案系统填报的年度财务报告，应当()。,经会计师事务所审计,经投资者认可,经律师事务所出具法律意见书,经托管人认可,
212,股权投资基金投资项目在境内申报上市的流程中，推出研究报告，进行公司定位和估值属于()的主要内容。,成立股份公司,上市前辅导,促销和发行,股票上市及后续,
